{
  "schema": {
    "name": "scfm_eval.model_spec",
    "version": "1.0.0"
  },
  "model_spec_id": "example-cell-model-v1",
  "created_at": "2026-07-17T22:00:00Z",
  "candidate": {
    "candidate_id": "example-cell-model",
    "fingerprint": "aaaaaaaaaaaaaaaaaaaaaaaaaaaaaaaaaaaaaaaaaaaaaaaaaaaaaaaaaaaaaaaa"
  },
  "model": {
    "model_id": "example-cell-model",
    "name": "Example Cell Model",
    "description": "Illustrative planner output; not a real executable model."
  },
  "license": {
    "expression": "Apache-2.0",
    "status": "compatible",
    "notes": "Illustrative license review."
  },
  "repository": {
    "url": "https://example.org/example-cell-model.git",
    "commit": "1111111111111111111111111111111111111111"
  },
  "weights": [
    {
      "artifact_id": "base-checkpoint",
      "url": "https://example.org/example-cell-model/weights.bin",
      "sha256": "2222222222222222222222222222222222222222222222222222222222222222",
      "filename": "weights/base.bin",
      "access": "public"
    }
  ],
  "adapter": {
    "module": "integrations.example_cell_model",
    "class": "ExampleCellModelAdapter",
    "output_key": "X_example_cell_model"
  },
  "tasks": [
    "cell_type"
  ],
  "constraints": {
    "requires_gpu": true,
    "min_gpu_memory_gb": 16,
    "platforms": [
      "linux-64"
    ],
    "notes": []
  }
}
